Symbol,Name,Last Sale,Net Change,% Change,Market Cap,Country,IPO Year,Volume,Sector,Industry
IRWD,Ironwood Pharmaceuticals Inc. Class A Common Stock,$0.6086,0.0376,6.585%,98483559.00,United States,2010,2870108,Health Care,Biotechnology: Pharmaceutical Preparations
ISBA,Isabella Bank Corporation Common stock,$27.95,0.00,0.00%,206336906.00,United States,,7447,Finance,Major Banks
ISPC,iSpecimen Inc. Common Stock,$1.26,0.00,0.00%,3146041.00,United States,2021,42102,Health Care,Biotechnology: Commercial Physical & Biological Resarch
ISPO,Inspirato Incorporated Class A Common Stock,$3.98,0.11,2.842%,49513496.00,United States,2021,6650,Finance,Blank Checks
ISPOW,Inspirato Incorporated Warrant,$0.0109,0.00,0.00%,135602.00,United States,2021,1,Finance,Blank Checks
ISPR,Ispire Technology Inc. Common Stock,$2.67,0.18,7.229%,152578365.00,United States,2023,47722,Health Care, Medicinal Chemicals and Botanical Products 
ISRG,Intuitive Surgical Inc. Common Stock,$557.08,-0.98,-0.176%,199667641495.00,United States,2000,1104155,Health Care,Industrial Specialties
ISRL,Israel Acquisitions Corp Class A Ordinary Shares,$12.43,-0.21,-1.661%,0.00,United States,2023,33397,Finance,Blank Checks
ISRLU,Israel Acquisitions Corp Unit,$14.40,1.92,15.385%,0.00,United States,2023,717,Finance,Blank Checks
ISRLW,Israel Acquisitions Corp Warrant,$0.1822,-0.0048,-2.567%,0.00,United States,2023,129020,Finance,Blank Checks
ISSC,Innovative Solutions and Support Inc. Common Stock,$11.76,0.07,0.599%,207024863.00,United States,2000,150849,Technology,EDP Services
ISTR,Investar Holding Corporation Common Stock,$19.33,0.68,3.646%,190300912.00,United States,2014,15303,Finance,Major Banks
ITIC,Investors Title Company Common Stock,$195.87,1.66,0.855%,369463313.00,United States,,57440,Finance,Specialty Insurers
ITOS,iTeos Therapeutics Inc. Common Stock,$10.17,-0.01,-0.098%,389244495.00,United States,2020,1062628,Health Care,Biotechnology: Biological Products (No Diagnostic Substances)
ITRI,Itron Inc. Common Stock,$120.56,1.05,0.879%,5496097840.00,United States,1993,413253,Industrials,Electrical Products
ITRM,Iterum Therapeutics plc Ordinary Share,$0.97,0.02,2.105%,38800000.00,Ireland,2018,368911,Health Care,Biotechnology: Pharmaceutical Preparations
ITRN,Ituran Location and Control Ltd. Ordinary Shares,$37.64,-0.10,-0.265%,748794351.00,Israel,2005,77505,Technology,Electronic Components
IVA,Inventiva S.A. American Depository Shares,$3.605,0.195,5.718%,344862920.00,France,2020,86072,Health Care,Biotechnology: Pharmaceutical Preparations
IVDA,Iveda Solutions Inc. Common Stock,$2.4227,0.0727,3.094%,6803114.00,United States,,255626,Technology,Computer Software: Prepackaged Software
IVDAW,Iveda Solutions Inc. Warrant,$0.11,0.00,0.00%,308888.00,United States,,1971,Technology,Computer Software: Prepackaged Software
IVF,INVO Fertility Inc. Common Stock,$1.46,-0.03,-2.013%,3137731.00,United States,,97881,Health Care,Medical/Dental Instruments
IVP,Inspire Veterinary Partners Inc. Class A Common Stock,$1.71,0.09,5.556%,3624432.00,United States,2023,19200,Consumer Staples,Farming/Seeds/Milling
IVVD,Invivyd Inc. Common Stock,$0.9894,0.0643,6.951%,118689854.00,United States,2021,1152620,Health Care,Biotechnology: Biological Products (No Diagnostic Substances)
IXHL,Incannex Healthcare Inc. Common Stock,$0.1793,0.0003,0.168%,5277480.00,Australia,,10868250,Health Care,Biotechnology: Pharmaceutical Preparations
IZEA,IZEA Worldwide Inc. Common Stock,$2.895,-0.025,-0.856%,49001065.00,United States,,52081,Consumer Discretionary,Advertising
IZM,ICZOOM Group Inc. Class A Ordinary Shares,$2.39,-0.0317,-1.309%,28039468.00,China,2023,11230,Consumer Discretionary,Consumer Electronics/Video Chains
JACK,Jack In The Box Inc. Common Stock,$20.29,0.84,4.319%,383063959.00,United States,,629896,Consumer Discretionary,Restaurants
JAGX,Jaguar Health Inc. Common Stock,$4.06,0.16,4.103%,4134493.00,United States,2015,64700,Health Care,Biotechnology: Pharmaceutical Preparations
JAKK,JAKKS Pacific Inc. Common Stock,$21.68,0.70,3.337%,241650266.00,United States,1996,105008,Consumer Discretionary,Recreational Games/Products/Toys
JAMF,Jamf Holding Corp. Common Stock,$10.67,0.13,1.233%,1406996349.00,United States,2020,725831,Technology,Computer Software: Prepackaged Software
JANX,Janux Therapeutics Inc. Common Stock,$26.21,1.45,5.856%,1550980865.00,United States,2021,609347,Health Care,Biotechnology: Pharmaceutical Preparations
JAZZ,Jazz Pharmaceuticals plc Common Stock (Ireland),$111.13,2.33,2.142%,6849257620.00,Ireland,2007,726472,Health Care,Biotechnology: Pharmaceutical Preparations
JBDI,JBDI Holdings Limited Ordinary Shares,$1.17,-0.05,-4.098%,23151375.00,Singapore,2024,67850,,
JBHT,J.B. Hunt Transport Services Inc. Common Stock,$140.21,1.09,0.783%,13908073604.00,United States,,421789,Industrials,Trucking Freight/Courier Services
JBIO,Jade Biosciences Inc. Common Stock,$7.19,0.30,4.354%,5954348.00,United States,2021,567200,Health Care,Biotechnology: Pharmaceutical Preparations
JBLU,JetBlue Airways Corporation Common Stock,$5.01,0.13,2.664%,1775242669.00,United States,2002,20496036,Consumer Discretionary,Air Freight/Delivery Services
JBSS,John B. Sanfilippo & Son Inc. Common Stock,$62.17,1.10,1.801%,731042980.00,United States,1991,33946,Consumer Staples,Specialty Foods
JCSE,JE Cleantech Holdings Limited Ordinary Shares,$1.13,-0.0201,-1.748%,5944094.00,Singapore,2022,12928,Consumer Discretionary,Miscellaneous manufacturing industries
JCTC,Jewett-Cameron Trading Company Common Shares,$3.7646,0.0002,0.005%,13244311.00,United States,,3025,Consumer Discretionary,RETAIL: Building Materials
JD,JD.com Inc. American Depositary Shares,$33.12,0.03,0.091%,48133112946.00,China,2014,8472128,Consumer Discretionary,Other Specialty Stores
JDZG,JIADE LIMITED Common stock,$0.2948,-0.0474,-13.852%,7233057.00,China,2024,3427957,Real Estate,Other Consumer Services
JFB,JFB Construction Holdings Class A Common Stock,$5.28,-0.0732,-1.367%,27720000.00,United States,2025,7949,,
JFBR,Jeffs' Brands Ltd Ordinary Shares,$0.4628,0.0187,4.211%,871380.00,Israel,2022,884444,Consumer Discretionary,Other Specialty Stores
JFBRW,Jeffs' Brands Ltd Warrant,$0.0247,0.00,0.00%,46506.00,Israel,2022,42,Consumer Discretionary,Other Specialty Stores
JFIN,Jiayin Group Inc. American Depositary Shares,$18.19,2.11,13.122%,970792042.00,China,2019,333555,Finance,Finance: Consumer Services
JFU,9F Inc. American Depositary Shares,$1.425,0.0749,5.548%,16777000.00,China,2019,1812,Finance,Finance: Consumer Services
JG,Aurora Mobile Limited American Depositary Shares,$9.83,-0.18,-1.798%,59728564.00,China,2018,27480,Technology,Computer Software: Programming Data Processing
JJSF,J & J Snack Foods Corp. Common Stock,$116.00,2.33,2.05%,2256836956.00,United States,1986,115334,Consumer Staples,Specialty Foods
JKHY,Jack Henry & Associates Inc. Common Stock,$181.84,0.83,0.459%,13240858894.00,United States,1985,277436,Technology,EDP Services
JL,J-Long Group Limited Ordinary Shares,$5.32,0.05,0.949%,16704800.00,Hong Kong,2024,7746,Consumer Discretionary,Clothing/Shoe/Accessory Stores
JMSB,John Marshall Bancorp Inc. Common Stock,$17.81,0.47,2.71%,254297164.00,United States,,16796,Finance,Major Banks
JOUT,Johnson Outdoors Inc. Class A Common Stock,$28.03,0.67,2.449%,289648678.00,United States,,27882,Consumer Discretionary,Recreational Games/Products/Toys
JOYY,JOYY Inc. American Depositary Shares,$48.00,0.20,0.418%,2482655616.00,Singapore,2012,484219,Technology,EDP Services
JRSH,Jerash Holdings (US) Inc. Common Stock,$3.13,-0.02,-0.635%,38482849.00,United States,2018,37032,Consumer Discretionary,Apparel
JRVR,James River Group Holdings Ltd. Common Shares,$5.93,0.07,1.195%,272146451.00,Bermuda,2014,677321,Finance,Property-Casualty Insurers
JSM,Navient Corporation 6% Senior Notes due December 15 2043,$18.255,-0.095,-0.518%,1849860896.00,United States,,28213,Finance,Investment Bankers/Brokers/Service
JSPR,Jasper Therapeutics Inc. Common Stock,$6.01,0.31,5.439%,90282953.00,United States,2020,316372,Health Care,Biotechnology: Biological Products (No Diagnostic Substances)
JSPRW,Japer Therapeutics Inc. Warrants,$0.1001,-0.0099,-9.00%,1503714.00,United States,2020,724,Health Care,Biotechnology: Biological Products (No Diagnostic Substances)
JTAI,Jet.AI Inc. Common Stock,$4.21,-0.33,-7.269%,10740788.00,United States,2021,292332,Consumer Discretionary,Transportation Services
JUNS,Jupiter Neurosciences Inc. Common Stock,$0.7804,-0.0479,-5.783%,25834252.00,United States,2024,101354,Health Care,Biotechnology: Pharmaceutical Preparations
JVA,Coffee Holding Co. Inc. Common Stock,$3.92,-0.255,-6.108%,22377708.00,United States,2005,190956,Consumer Staples,Packaged Foods
JVSA,JV SPAC Acquisition Corp. Class A Ordinary Share,$10.85,0.00,0.00%,0.00,China,2024,228120,,
JVSAR,JV SPAC Acquisition Corp. Right,$0.3917,-0.0783,-16.66%,0.00,China,2024,23901,,
JVSAU,JVSPAC Acquisition Corp. Unit,$11.55,0.16,1.405%,0.00,China,2024,900,,
JWEL,Jowell Global Ltd. Ordinary Shares,$1.9295,-0.016,-0.822%,4187932.00,China,2021,550,Consumer Discretionary,Other Consumer Services
JXG,JX Luxventure Group Inc. Common Stock,$2.45,-0.03,-1.21%,9900332.00,China,2013,96580,Consumer Staples,Apparel
JYD,Jayud Global Logistics Limited Class A Ordinary Shares,$0.2181,-0.003,-1.357%,20465696.00,China,2023,1392591,Consumer Discretionary,Oil Refining/Marketing
JYNT,The Joint Corp. Common Stock,$12.01,-0.30,-2.437%,183786292.00,United States,2014,52055,Miscellaneous,Multi-Sector Companies
JZ,Jianzhi Education Technology Group Company Limited American Depositary Shs,$0.40,0.04,11.111%,11274000.00,China,2022,405048,Real Estate,Other Consumer Services
JZXN,Jiuzi Holdings Inc. Ordinary Shares,$4.27,-0.10,-2.288%,47018631.00,China,2021,23248,Consumer Discretionary,Retail-Auto Dealers and Gas Stations
KALA,KALA BIO Inc. Common Stock,$4.14,-0.03,-0.719%,26712928.00,United States,2017,39447,Health Care,Biotechnology: Pharmaceutical Preparations
KALU,Kaiser Aluminum Corporation Common Stock,$78.165,0.585,0.754%,1262706800.00,United States,,64878,Industrials,Metal Fabrications
KALV,KalVista Pharmaceuticals Inc. Common Stock,$14.365,0.565,4.094%,714165111.00,United Kingdom,2015,544267,Health Care,Biotechnology: Pharmaceutical Preparations
KARO,Karooooo Ltd. Ordinary Shares,$58.35,0.49,0.847%,1803015000.00,Singapore,2021,45917,Technology,Computer Software: Prepackaged Software
KAVL,Kaival Brands Innovations Group Inc. Common Stock,$0.5713,0.0073,1.294%,6594117.00,United States,,7031,Consumer Discretionary,Other Consumer Services
KBSX,FST Corp. Ordinary Shares,$1.47,-0.07,-4.545%,55491590.00,Taiwan,,36307,Consumer Discretionary,Recreational Games/Products/Toys
KC,Kingsoft Cloud Holdings Limited American Depositary Shares,$11.97,-0.40,-3.234%,3258062266.00,China,2020,1821025,Technology,Computer Software: Prepackaged Software
KCHVU,Kochav Defense Acquisition Corp. Units,$10.065,0.02,0.199%,0.00,United States,2025,75886,,
KDP,Keurig Dr Pepper Inc. Common Stock,$32.77,0.21,0.645%,44507495321.00,United States,,8121186,Consumer Staples,Beverages (Production/Distribution)
KE,Kimball Electronics Inc. Common Stock,$18.51,-0.03,-0.162%,451281093.00,United States,,116032,Technology,Electrical Products
KELYA,Kelly Services Inc. Class A Common Stock,$11.91,0.24,2.057%,419268433.00,United States,,191345,Consumer Discretionary,Professional Services
KELYB,Kelly Services Inc. Class B Common Stock,$11.4401,0.00,0.00%,402726515.00,United States,,37,Consumer Discretionary,Professional Services
KEQU,Kewaunee Scientific Corporation Common Stock,$39.29,0.08,0.204%,112151891.00,United States,,7552,Industrials,Medical Specialities
KFFB,Kentucky First Federal Bancorp Common Stock,$2.61,-0.0036,-0.138%,21106326.00,United States,2005,5587,Finance,Savings Institutions
KFII,K&F Growth Acquisition Corp. II Class A Ordinary shares,$10.135,0.015,0.148%,0.00,United States,2025,51005,,
KFIIR,K&F Growth Acquisition Corp. II Rights,$0.1499,0.0099,7.071%,0.00,United States,2025,65756,,
KFIIU,K&F Growth Acquisition Corp. II Unit,$10.27,0.00,0.00%,0.00,United States,2025,1581,Finance,Blank Checks
KG,Kestrel Group Ltd.,$25.68,3.64,16.515%,2559851993.00,Bermuda,2008,19358,Finance,Property-Casualty Insurers
KGEI,Kolibri Global Energy Inc. Common stock,$6.82,0.10,1.488%,241788457.00,United States,,74388,Energy,Oil & Gas Production
KHC,The Kraft Heinz Company Common Stock,$26.73,0.11,0.413%,31636080360.00,United States,,6554854,Consumer Staples,Packaged Foods
KIDS,OrthoPediatrics Corp. Common Stock,$21.19,0.33,1.582%,524856148.00,United States,2017,241054,Health Care,Medical/Dental Instruments
KIDZ,Classover Holdings Inc. Class B Common Stock,$3.74,0.06,1.63%,88597357.00,United States,,932723,Real Estate,Other Consumer Services
KIDZW,Classover Holdings Inc. Warrants,$0.2274,0.0074,3.364%,5386909.00,United States,,140821,,
KINS,Kingstone Companies Inc. Common Stock,$15.23,0.24,1.601%,213308288.00,United States,,159312,Finance,Property-Casualty Insurers
KIRK,Kirkland's Inc. COMMONSTOCK,$1.32,0.15,12.821%,29639739.00,United States,2002,646009,Consumer Discretionary,Other Specialty Stores
KITT,Nauticus Robotics Inc. Common stock,$0.9601,0.0531,5.854%,35811335.00,United States,2021,1343390,Industrials,Industrial Machinery/Components
KITTW,Nauticus Robotics Inc. Warrant,$0.0593,-0.0084,-12.408%,2211866.00,United States,2021,77007,Industrials,Industrial Machinery/Components
KLAC,KLA Corporation Common Stock,$808.00,16.11,2.034%,106851075440.00,United States,1980,996291,Technology,Electronic Components
KLIC,Kulicke and Soffa Industries Inc. Common Stock,$33.17,0.27,0.821%,1750359273.00,Singapore,,1052412,Technology,Semiconductors
KLRS,Kalaris Therapeutics Inc. Common Stock,$3.30,0.19,6.109%,61717979.00,United States,2020,30130,Health Care,Biotechnology: Biological Products (No Diagnostic Substances)
KLTO,Klotho Neurosciences Inc. Common Stock,$0.205,0.0099,5.074%,6661350.00,United States,2022,27827675,Health Care,Biotechnology: Biological Products (No Diagnostic Substances)
KLTOW,Klotho Neurosciences Inc. Warrant,$0.0193,-0.0006,-3.015%,627142.00,United States,2022,64788,Health Care,Biotechnology: Biological Products (No Diagnostic Substances)
KLTR,Kaltura Inc. Common Stock,$2.23,0.02,0.905%,342570765.00,United States,2021,253910,Technology,Computer Software: Prepackaged Software
KLXE,KLX Energy Services Holdings Inc. Common Stock,$1.99,0.20,11.173%,34932331.00,United States,,158396,Energy,Oilfield Services/Equipment
KMB,Kimberly-Clark Corporation Common Stock,$133.55,-0.49,-0.366%,44314031474.00,United States,,2575720,Consumer Discretionary,Containers/Packaging
KMDA,Kamada Ltd. Ordinary Shares,$6.85,0.07,1.032%,393909462.00,Israel,2013,74918,Health Care,Biotechnology: Pharmaceutical Preparations
KMTS,Kestra Medical Technologies Ltd. Common Stock,$20.70,0.74,3.707%,1062917179.00,United States,2025,133037,Health Care,Medical/Dental Instruments
KNDI,Kandi Technologies Group Inc. Ordinary Shares,$1.09,0.00,0.00%,95220475.00,China,,66093,Consumer Discretionary,Auto Manufacturing
KNSA,Kiniksa Pharmaceuticals International plc Class A Ordinary Shares,$30.23,0.71,2.405%,2205912332.00,United States,2018,1070355,Health Care,Biotechnology: Pharmaceutical Preparations
KOD,Kodiak Sciences Inc Common Stock,$4.22,0.30,7.653%,222662143.00,United States,2018,354244,Health Care,Biotechnology: Biological Products (No Diagnostic Substances)
KOPN,Kopin Corporation Common Stock,$1.47,-0.01,-0.676%,239312945.00,United States,1992,1811910,Technology,Semiconductors
KOSS,Koss Corporation Common Stock,$5.65,-0.07,-1.224%,52973242.00,United States,,28777,Consumer Staples,Consumer Electronics/Appliances
KPLT,Katapult Holdings Inc. Common Stock,$9.40,0.45,5.028%,42653139.00,United States,2019,83666,Consumer Discretionary,Diversified Commercial Services
KPLTW,Katapult Holdings Inc. Warrant,$0.0069,0.0006,9.524%,31309.00,United States,2019,43718,Consumer Discretionary,Diversified Commercial Services
KPRX,Kiora Pharmaceuticals Inc.  Common Stock,$3.08,-0.01,-0.324%,9375080.00,United States,,229932,Health Care,Biotechnology: Pharmaceutical Preparations
KPTI,Karyopharm Therapeutics Inc. Common Stock,$4.49,0.23,5.399%,38793169.00,United States,2013,139735,Health Care,Biotechnology: Pharmaceutical Preparations
KRKR,36Kr Holdings Inc. American Depositary Shares,$5.90,-0.007,-0.119%,232551114.00,China,2019,1098,Consumer Discretionary,Business Services
KRMD,KORU Medical Systems Inc. Common Stock (DE),$3.08,0.16,5.479%,142114268.00,United States,,149429,Health Care,Medical/Dental Instruments
KRNT,Kornit Digital Ltd. Ordinary Shares,$22.54,0.21,0.94%,1021681918.00,Israel,2015,200104,Industrials,Industrial Machinery/Components
KRNY,Kearny Financial Corp Common Stock,$6.11,0.17,2.862%,394581863.00,United States,2005,300812,Finance,Savings Institutions
KRON,Kronos Bio Inc. Common Stock,$0.872,0.0021,0.241%,53165155.00,United States,2020,1784799,Health Care,Biotechnology: Pharmaceutical Preparations
KROS,Keros Therapeutics Inc. Common Stock,$15.04,-0.07,-0.463%,610855827.00,United States,2020,739701,Health Care,Biotechnology: Pharmaceutical Preparations
KRRO,Korro Bio Inc. Common Stock,$14.59,2.24,18.138%,137007278.00,United States,2019,280781,Health Care,Biotechnology: Pharmaceutical Preparations
KRT,Karat Packaging Inc. Common Stock,$31.22,0.32,1.036%,626257746.00,United States,2021,58509,Industrials,Plastic Products
KRUS,Kura Sushi USA Inc. Class A Common Stock,$78.79,3.39,4.496%,952214103.00,United States,2019,336665,Consumer Discretionary,Restaurants
KRYS,Krystal Biotech Inc. Common Stock,$136.94,4.32,3.257%,3957385239.00,United States,2017,265893,Health Care,Biotechnology: Biological Products (No Diagnostic Substances)
KSCP,Knightscope Inc. Class A Common Stock,$6.27,0.25,4.153%,43270681.00,United States,2022,268063,Telecommunications,Telecommunications Equipment
KSPI,Joint Stock Company Kaspi.kz American Depository Shares,$85.93,1.14,1.344%,16269424647.00,Kazakhstan,2024,223155,,
KTCC,Key Tronic Corporation Common Stock,$2.93,0.06,2.091%,31532282.00,United States,1983,19396,Technology,Electrical Products
KTOS,Kratos Defense & Security Solutions Inc. Common Stock,$40.47,0.11,0.273%,6209852051.00,United States,,2031430,Industrials,Military/Government/Technical
KTTA,Pasithea Therapeutics Corp. Common Stock,$0.8858,0.0058,0.659%,6593521.00,United States,2021,155479,Health Care,Biotechnology: Pharmaceutical Preparations
KURA,Kura Oncology Inc. Common Stock,$6.73,0.16,2.435%,582647644.00,United States,,765766,Health Care,Biotechnology: Pharmaceutical Preparations
KVAC,Keen Vision Acquisition Corporation Ordinary Shares,$11.31,0.00,0.00%,0.00,United States,2023,79,,
KVACW,Keen Vision Acquisition Corporation Warrant,$0.0452,0.00,0.00%,0.00,United States,2023,88,,
KVHI,KVH Industries Inc. Common Stock,$5.20,0.06,1.167%,101917197.00,United States,1996,6242,Technology,Radio And Television Broadcasting And Communications Equipment
KWE,KWESST Micro Systems Inc. Common Stock,$5.80,0.06,1.045%,3076111.00,Canada,,191062,Technology,Computer Software: Prepackaged Software
KWESW,KWESST Micro Systems Inc. Warrant,$0.045,0.00,0.00%,23866.00,Canada,,3400,Technology,Computer Software: Prepackaged Software
KWM,K Wave Media Ltd. Ordinary Shares,$3.40,-0.17,-4.762%,214750800.00,Cayman Islands,,1015427,Consumer Discretionary,Movies/Entertainment
KWMWW,K Wave Media Ltd. Warrant,$0.1222,0.0102,9.107%,7718396.00,Cayman Islands,,73802,Consumer Discretionary,Movies/Entertainment
KXIN,Kaixin Holdings Ordinary Shares,$0.96,-0.0196,-2.001%,10515192.00,China,2017,19239,Consumer Discretionary,Retail-Auto Dealers and Gas Stations
KYMR,Kymera Therapeutics Inc. Common Stock,$47.62,-0.04,-0.084%,3100993828.00,United States,2020,988058,Health Care,Biotechnology: Biological Products (No Diagnostic Substances)
KYTX,Kyverna Therapeutics Inc. Common Stock,$3.39,0.45,15.306%,146511979.00,United States,2024,528572,Health Care,Biotechnology: Biological Products (No Diagnostic Substances)
KZIA,Kazia Therapeutics Limited American Depositary Shares,$5.65,0.305,5.706%,7681881.00,Australia,,32178,Health Care,Biotechnology: Pharmaceutical Preparations
KZR,Kezar Life Sciences Inc. Common Stock,$4.40,0.02,0.457%,32145520.00,United States,2018,18699,Health Care,Biotechnology: Pharmaceutical Preparations
LAB,Standard BioTools Inc. Common Stock,$1.06,0.0661,6.651%,402611604.00,United States,2011,1095903,Industrials,Biotechnology: Laboratory Analytical Instruments
LAES,SEALSQ Corp Ordinary Shares,$3.46,0.21,6.462%,361600797.00,Switzerland,,5070144,Technology,Semiconductors
LAKE,Lakeland Industries Inc. Common Stock,$18.02,-0.43,-2.331%,171164844.00,United States,1986,120116,Health Care,Industrial Specialties
LAMR,Lamar Advertising Company Class A Common Stock,$121.03,0.93,0.774%,12392266541.00,United States,1996,385721,Real Estate,Real Estate Investment Trusts
LANC,Lancaster Colony Corporation Common Stock,$167.93,1.79,1.077%,4629662170.00,United States,,109605,Consumer Staples,Packaged Foods
LAND,Gladstone Land Corporation Common Stock,$9.79,0.14,1.451%,354247802.00,United States,2013,203084,Real Estate,Real Estate Investment Trusts
LANDM,Gladstone Land Corporation 5.00% Series D Cumulative Term Preferred Stock,$24.6574,0.0074,0.03%,892219586.00,United States,,1279,Real Estate,Real Estate Investment Trusts
LANDO,Gladstone Land Corporation 6.00% Series B Cumulative Redeemable Preferred Stock,$19.37,-0.07,-0.36%,700896825.00,United States,,15596,Real Estate,Real Estate Investment Trusts
LANDP,Gladstone Land Corporation 6.00% Series C Cumulative Redeemable Preferred Stock,$19.518,-0.022,-0.113%,706252155.00,United States,,12757,Real Estate,Real Estate Investment Trusts
LARK,Landmark Bancorp Inc. Common Stock,$28.40,0.01,0.035%,164239444.00,United States,,7629,Finance,Major Banks
LASE,Laser Photonics Corporation Common Stock,$2.25,-0.05,-2.174%,31122889.00,United States,2022,87150,Miscellaneous,Industrial Machinery/Components
LASR,nLIGHT Inc. Common Stock,$17.60,-0.22,-1.235%,870134690.00,United States,2018,1018525,Technology,Semiconductors
LAUR,Laureate Education Inc. Common Stock,$22.31,0.05,0.225%,3319954737.00,United States,2017,590191,Real Estate,Other Consumer Services
LAZR,Luminar Technologies Inc.  Class A Common Stock,$3.37,0.05,1.506%,157981634.00,United States,2019,1697420,Consumer Discretionary,Auto Parts:O.E.M.
LBGJ,Li Bang International Corporation Inc. Ordinary Shares,$1.60,0.02,1.266%,29632000.00,China,2024,9337,,
LBRDA,Liberty Broadband Corporation Class A Common Stock,$93.39,1.25,1.357%,13385634928.00,United States,,110524,Telecommunications,Cable & Other Pay Television Services
LBRDK,Liberty Broadband Corporation Class C Common Stock,$94.16,1.15,1.236%,13495999409.00,United States,,520400,Telecommunications,Cable & Other Pay Television Services
LBRDP,Liberty Broadband Corporation Series A Cumulative Redeemable Preferred Stock,$24.248,-0.1088,-0.447%,3475477843.00,United States,,3388,Telecommunications,Cable & Other Pay Television Services
LBTYA,Liberty Global Ltd. Class A Common Shares,$9.70,-0.02,-0.206%,3352113283.00,United Kingdom,,1965025,Telecommunications,Cable & Other Pay Television Services
LBTYB,Liberty Global Ltd. Class B Common Shares,$9.61,0.00,0.00%,3321011201.00,United Kingdom,,23,Telecommunications,Cable & Other Pay Television Services
LBTYK,Liberty Global Ltd. Class C Common Shares,$9.96,-0.04,-0.40%,3441963742.00,United Kingdom,,941635,Telecommunications,Cable & Other Pay Television Services
LCCCU,Lakeshore Acquisition III Corp. Unit,$10.0895,0.0095,0.094%,0.00,United States,2025,1163,Finance,Blank Checks
LCFY,Locafy Limited Ordinary Share,$3.98,-0.10,-2.451%,5501096.00,Australia,2022,2891,Technology,Computer Software: Programming Data Processing
LCFYW,Locafy Limited Warrant,$9.00,0.00,0.00%,12439665.00,Australia,2022,212,Technology,Computer Software: Programming Data Processing
LCID,Lucid Group Inc. Common Stock,$2.15,0.02,0.939%,6558063375.00,United States,,130155889,Consumer Discretionary,Auto Manufacturing
LCNB,LCNB Corporation Common Stock,$14.38,0.38,2.714%,203727615.00,United States,,8344,Finance,Major Banks
LCUT,Lifetime Brands Inc. Common Stock,$3.43,0.06,1.78%,76880037.00,United States,1991,66853,Consumer Discretionary,Industrial Machinery/Components
LDTC,LeddarTech Holdings Inc. Common Shares,$0.3497,0.0087,2.551%,10562225.00,United States,2021,69967,Technology,Computer Software: Prepackaged Software
LDTCW,LeddarTech Holdings Inc. Warrants,$0.0225,-0.0016,-6.639%,679583.00,United States,2021,15152,Technology,Computer Software: Prepackaged Software
LDWY,Lendway Inc. Common Stock (DE),$5.20,-0.0475,-0.905%,9201915.00,United States,,6677,Consumer Staples,Farming/Seeds/Milling
LE,Lands' End Inc. Common Stock,$7.99,-0.95,-10.626%,246742602.00,United States,,540395,Consumer Discretionary,Clothing/Shoe/Accessory Stores
LECO,Lincoln Electric Holdings Inc. Common Shares,$201.44,2.71,1.364%,11245646649.00,United States,,312863,Industrials,Industrial Machinery/Components
LEDS,SemiLEDS Corporation Common Stock,$2.92,0.06,2.098%,23946824.00,Taiwan,2010,8832,Technology,Semiconductors
LEE,Lee Enterprises Incorporated Common Stock,$6.65,-0.08,-1.189%,41363426.00,United States,,8958,Consumer Discretionary,Newspapers/Magazines
LEGH,Legacy Housing Corporation Common Stock (TX),$21.92,-0.33,-1.483%,528664280.00,United States,2018,95925,Consumer Discretionary,Homebuilding
LEGN,Legend Biotech Corporation American Depositary Shares,$35.00,3.52,11.182%,6427720530.00,United States,2020,4196083,Health Care,Biotechnology: Pharmaceutical Preparations
LENZ,LENZ Therapeutics Inc. Common Stock,$31.96,1.66,5.479%,899551082.00,United States,2021,476060,Health Care,Biotechnology: Biological Products (No Diagnostic Substances)
LESL,Leslie's Inc. Common Stock,$0.7084,-0.0193,-2.652%,131352702.00,United States,2020,2398432,Consumer Discretionary,Other Specialty Stores
