Symbol,Name,Last Sale,Net Change,% Change,Market Cap,Country,IPO Year,Volume,Sector,Industry
RDACR,Rising Dragon Acquisition Corp. Rights,$0.1717,-0.0083,-4.611%,0.00,China,2024,204,Finance,Blank Checks
RDAGU,Republic Digital Acquisition Company Unit,$10.56,0.02,0.19%,0.00,United States,2025,861544,Finance,Blank Checks
RDCM,Radcom Ltd. Ordinary Shares,$13.15,-0.08,-0.605%,209290350.00,Israel,1997,50996,Technology,Computer peripheral equipment
RDFN,Redfin Corporation Common Stock,$9.96,-0.02,-0.20%,1275190543.00,United States,2017,4417382,Finance,Real Estate
RDGT,Ridgetech Inc. Ordinary Shares,$0.96,-0.0101,-1.041%,6387914.00,China,,941,Consumer Staples,Retail-Drug Stores and Proprietary Stores
RDHL,Redhill Biopharma Ltd. American Depositary Shares,$1.99,0.06,3.109%,4560192.00,Israel,,11402,Health Care,Biotechnology: Pharmaceutical Preparations
RDI,Reading International Inc Class A Common Stock,$1.40,0.00,0.00%,31467006.00,United States,,5276,Consumer Discretionary,Movies/Entertainment
RDIB,Reading International Inc Class B Common Stock,$9.595,-2.255,-19.03%,215661375.00,United States,,19871,Consumer Discretionary,Movies/Entertainment
RDNT,RadNet Inc. Common Stock,$58.65,0.58,0.999%,4400515248.00,United States,,407022,Health Care,Medical Specialities
RDUS,Radius Recycling Inc. Class A Common Stock,$29.62,0.04,0.135%,835342707.00,United States,,635624,Consumer Discretionary,Industrial Specialties
RDVT,Red Violet Inc. Common Stock ,$45.64,-0.69,-1.489%,636948098.00,United States,,84393,Technology,Computer Software: Prepackaged Software
RDWR,Radware Ltd. Ordinary Shares,$24.28,0.25,1.04%,1036429046.00,Israel,1999,107690,Consumer Discretionary,Business Services
RDZN,Roadzen Inc. Ordinary Shares,$1.04,0.0554,5.627%,77158625.00,United States,2022,249615,Finance,Specialty Insurers
RDZNW,Roadzen Inc. Warrants,$0.0701,0.0101,16.833%,5200788.00,United States,2022,2074,Finance,Specialty Insurers
REAL,The RealReal Inc. Common Stock,$5.71,0.14,2.513%,645774329.00,United States,2019,1705231,Consumer Discretionary,Other Specialty Stores
REAX,The Real Brokerage Inc. Common Shares,$4.20,0.08,1.942%,862197277.00,Canada,,1197150,Finance,Real Estate
REBN,Reborn Coffee Inc. Common Stock,$2.45,0.02,0.823%,12993100.00,United States,2022,38949,Consumer Discretionary,Restaurants
RECT,Rectitude Holdings Ltd Ordinary Shares,$4.76,0.05,1.062%,69020000.00,Singapore,2024,1748,Consumer Discretionary,Industrial Machinery/Components
REE,REE Automotive Ltd. Class A Ordinary Shares,$0.78,0.034,4.558%,24196327.00,Israel,,168653,Consumer Discretionary,Auto Manufacturing
REFI,Chicago Atlantic Real Estate Finance Inc. Common Stock,$14.36,0.07,0.49%,301092683.00,United States,2021,76837,Real Estate,Real Estate Investment Trusts
REFR,Research Frontiers Incorporated Common Stock,$2.00,-0.02,-0.99%,67296442.00,United States,,27474,Miscellaneous,Multi-Sector Companies
REG,Regency Centers Corporation Common Stock,$72.01,0.77,1.081%,13071924101.00,United States,1993,1144774,Real Estate,Real Estate Investment Trusts
REGCO,Regency Centers Corporation 5.875% Series B Cumulative Redeemable Preferred Stock,$21.95,-0.15,-0.679%,3984567894.00,United States,,5026,Real Estate,Real Estate Investment Trusts
REGCP,Regency Centers Corporation 6.25% Series A Cumulative Redeemable Preferred Stock,$23.04,-0.08,-0.346%,4182434819.00,United States,,1855,Real Estate,Real Estate Investment Trusts
REGN,Regeneron Pharmaceuticals Inc. Common Stock,$493.22,10.15,2.101%,53250742430.00,United States,1991,1497876,Health Care,Biotechnology: Pharmaceutical Preparations
REKR,Rekor Systems Inc. Common Stock,$1.415,-0.045,-3.082%,167077461.00,United States,,7929509,Telecommunications,Telecommunications Equipment
RELI,Reliance Global Group Inc. Common Stock,$1.47,-0.04,-2.649%,4373116.00,United States,,43074,Finance,Specialty Insurers
RELL,Richardson Electronics Ltd. Common Stock,$9.31,0.31,3.444%,133831250.00,United States,1983,30336,Technology,Electronic Components
RELY,Remitly Global Inc. Common Stock,$21.54,0.66,3.161%,4391114072.00,United States,2021,2727527,Consumer Discretionary,Business Services
RENB,Renovaro Inc. Common Stock,$0.3089,-0.0039,-1.247%,53167426.00,United States,,2482110,Health Care,Biotechnology: Pharmaceutical Preparations
RENT,Rent the Runway Inc. Class A Common Stock,$8.62,1.88,27.893%,34320487.00,United States,2021,2252105,Consumer Discretionary,Other Specialty Stores
REPL,Replimune Group Inc. Common Stock,$10.38,0.63,6.462%,800160465.00,United States,2018,1927195,Health Care,Biotechnology: Biological Products (No Diagnostic Substances)
RETO,ReTo Eco-Solutions Inc. Class A Shares,$3.19,-0.11,-3.333%,24447774.00,China,2017,9391,Industrials,Industrial Machinery/Components
REVB,Revelation Biosciences Inc. Common Stock,$0.8594,0.0444,5.448%,828286.00,United States,2020,865259,Health Care,Biotechnology: Pharmaceutical Preparations
REVBW,Revelation Biosciences Inc. Warrant,$0.0112,0.0021,23.077%,10795.00,United States,2020,34143,Health Care,Biotechnology: Pharmaceutical Preparations
REYN,Reynolds Consumer Products Inc. Common Stock,$21.74,0.26,1.21%,4572427955.00,United States,2020,1132580,Consumer Discretionary,Containers/Packaging
RFAI,RF Acquisition Corp II Ordinary Shares,$10.51,0.00,0.00%,0.00,Singapore,2024,2,,
RFAIR,RF Acquisition Corp II Right,$0.07,0.0007,1.01%,0.00,Singapore,2024,3773,Technology,Computer Software: Prepackaged Software
RFIL,RF Industries Ltd. Common Stock,$4.04,-0.06,-1.463%,43106303.00,United States,,38668,Technology,Electrical Products
RGC,Regencell Bioscience Holdings Limited Ordinary Shares,$685.85,60.90,9.745%,8924874146.00,Hong Kong,2021,42654,Health Care, Medicinal Chemicals and Botanical Products 
RGCO,RGC Resources Inc. Common Stock,$20.70,0.20,0.976%,213449975.00,United States,,6194,Utilities,Oil & Gas Production
RGEN,Repligen Corporation Common Stock,$128.30,1.60,1.263%,7208291730.00,United States,1986,600683,Health Care,Biotechnology: Biological Products (No Diagnostic Substances)
RGLD,Royal Gold Inc. Common Stock,$175.93,-7.92,-4.308%,11579096141.00,United States,,682089,Industrials,Precious Metals
RGLS,Regulus Therapeutics Inc. Common Stock,$8.22,0.12,1.481%,569104212.00,United States,2012,2775764,Health Care,Biotechnology: Pharmaceutical Preparations
RGNX,REGENXBIO Inc. Common Stock,$9.61,1.25,14.952%,482040983.00,United States,2015,1911511,Health Care,Biotechnology: Biological Products (No Diagnostic Substances)
RGP,Resources Connection Inc. Common Stock,$5.14,0.07,1.381%,169976079.00,United States,,217069,Consumer Discretionary,Business Services
RGS,Regis Corporation Common Stock,$23.09,0.94,4.244%,56246801.00,United States,1991,5335,Consumer Discretionary,Other Consumer Services
RGTI,Rigetti Computing Inc. Common Stock,$11.28,0.39,3.581%,3274842188.00,United States,,38198561,Technology,EDP Services
RGTIW,Rigetti Computing Inc. Warrants,$3.915,0.215,5.811%,1136614110.00,United States,,389709,Technology,EDP Services
RHLD,Resolute Holdings Management Common Stock ,$36.31,0.57,1.595%,309578987.00,United States,,16561,Finance,Finance: Consumer Services
RIBB,Ribbon Acquisition Corp Class A Ordinary Shares,$10.08,-0.0055,-0.055%,0.00,Japan,2025,100,,
RIBBR,Ribbon Acquisition Corp Rights,$0.1799,0.00,0.00%,0.00,Japan,2025,8,,
RICK,RCI Hospitality Holdings Inc. Common Stock,$41.68,1.28,3.168%,366711060.00,United States,1995,27661,Consumer Discretionary,Restaurants
RIGL,Rigel Pharmaceuticals Inc. Common Stock,$21.49,0.52,2.48%,384078564.00,United States,2000,182064,Health Care,Biotechnology: Pharmaceutical Preparations
RILY,B. Riley Financial Inc. Common Stock,$2.995,0.065,2.218%,91338713.00,United States,,1312092,Finance,Investment Managers
RILYG,B. Riley Financial Inc. 5.00% Senior Notes due 2026,$10.23,0.79,8.369%,311984985.00,United States,,25323,Finance,Investment Managers
RILYK,B. Riley Financial Inc. 5.50% Senior Notes Due 2026,$19.65,0.07,0.358%,599267347.00,United States,,19594,Finance,Investment Managers
RILYL,B. Riley Financial Inc. Depositary Shares each representing 1/1000th in a share of 7.375% Series B Cumulative Perpetual Preferred Stock par value $0.0001,$2.35,0.25,11.905%,71668105.00,United States,,9238,Finance,Investment Managers
RILYN,B. Riley Financial Inc. 6.50% Senior Notes Due 2026,$11.30,0.30,2.727%,344616846.00,United States,,19177,Finance,Investment Managers
RILYP,B. Riley Financial Inc. Depositary Shares each representing a 1/1000th fractional interest in a share of Series A Cumulative Perpetual Preferred Stock,$2.16,0.07,3.349%,65873663.00,United States,,2434,Finance,Investment Managers
RILYT,B. Riley Financial Inc. 6.00% Senior Notes Due 2028,$6.84,0.3299,5.068%,208599931.00,United States,,23017,Finance,Investment Managers
RILYZ,B. Riley Financial Inc. 5.25% Senior Notes due 2028,$6.23,0.3705,6.323%,189996721.00,United States,,44546,Finance,Investment Managers
RIME,Algorhythm Holdings Inc. Common Stock,$2.50,-0.18,-6.716%,6286428.00,United States,,211467,Consumer Staples,Diversified Electronic Products
RIOT,Riot Platforms Inc. Common Stock ,$9.85,0.86,9.566%,3519047859.00,United States,,55833839,Finance,Finance: Consumer Services
RITR,Reitar Logtech Holdings Limited Ordinary shares,$4.92,-0.64,-11.511%,404055000.00,Hong Kong,2024,605730,Finance,Real Estate
RIVN,Rivian Automotive Inc. Class A Common Stock,$14.00,0.22,1.597%,16049948222.00,United States,2021,24415439,Consumer Discretionary,Auto Manufacturing
RKDA,Arcadia Biosciences Inc. Common Stock,$4.955,0.165,3.445%,6773683.00,United States,2015,77744,Consumer Staples,Farming/Seeds/Milling
RKLB,Rocket Lab Corporation Common Stock,$28.92,2.47,9.338%,13344624806.00,United States,2020,34064053,Industrials,Military/Government/Technical
RLAY,Relay Therapeutics Inc. Common Stock,$3.36,0.12,3.704%,576055086.00,United States,2020,1766554,Health Care,Biotechnology: Biological Products (No Diagnostic Substances)
RLMD,Relmada Therapeutics Inc. Common Stock,$0.8349,0.0149,1.817%,27711685.00,United States,,474370,Health Care,Biotechnology: Pharmaceutical Preparations
RLYB,Rallybio Corporation Common Stock,$0.395,0.0558,16.45%,16437516.00,United States,2021,401934,Health Care,Biotechnology: Pharmaceutical Preparations
RMBI,Richmond Mutual Bancorporation Inc. Common Stock,$13.63,0.67,5.17%,141854061.00,United States,2019,72921,Finance,Major Banks
RMBL,RumbleOn Inc. Class B Common Stock,$1.79,0.08,4.678%,67767660.00,United States,,80738,Technology,EDP Services
RMBS,Rambus Inc. Common Stock,$57.43,0.87,1.538%,6168666336.00,United States,1997,825374,Technology,Semiconductors
RMCF,Rocky Mountain Chocolate Factory Inc. Common Stock,$1.18,-0.01,-0.84%,9071016.00,United States,,8864,Consumer Staples,Specialty Foods
RMCO,Royalty Management Holding Corporation Class A Common Stock,$1.05,-0.0266,-2.471%,15685034.00,United States,2023,1990,Miscellaneous,Multi-Sector Companies
RMCOW,Royalty Management Holding Corporation Warrant,$0.035,0.00,0.00%,522834.00,United States,2023,50,Miscellaneous,Multi-Sector Companies
RMNI,Rimini Street Inc. (DE) Common Stock,$3.17,-0.01,-0.314%,290958450.00,United States,2015,634179,Consumer Discretionary,Business Services
RMR,The RMR Group Inc. Class A Common Stock,$15.40,0.35,2.326%,490909588.00,United States,,124022,Consumer Discretionary,Professional Services
RMSG,Real Messenger Corporation Ordinary Shares,$1.755,-0.005,-0.284%,16358878.00,United States,,24081,Technology,Computer Software: Programming Data Processing
RMSGW,Real Messenger Corporation Warrants,$0.0308,0.0001,0.326%,287096.00,United States,,11960,Technology,Computer Software: Programming Data Processing
RMTI,Rockwell Medical Inc. Common Stock,$1.02,0.044,4.508%,34858181.00,United States,1998,215928,Health Care,Biotechnology: Pharmaceutical Preparations
RNA,Avidity Biosciences Inc. Common Stock,$36.24,0.65,1.826%,4368310130.00,United States,2020,1533202,Health Care,Biotechnology: Pharmaceutical Preparations
RNAC,Cartesian Therapeutics Inc. Common Stock,$11.035,1.695,18.148%,286405601.00,United States,2016,100184,Health Care,Biotechnology: Pharmaceutical Preparations
RNAZ,TransCode Therapeutics Inc. Common Stock,$7.14,-0.08,-1.108%,5952047.00,United States,2021,33526,Health Care,Biotechnology: Pharmaceutical Preparations
RNTX,Rein Therapeutics Inc. Common Stock,$2.00,0.05,2.564%,44307472.00,United States,2017,4485,Health Care,Biotechnology: Pharmaceutical Preparations
RNW,ReNew Energy Global plc Class A Ordinary Shares,$6.90,0.16,2.374%,3370882164.00,United Kingdom,,629135,Utilities,Electric Utilities: Central
RNWWW,ReNew Energy Global plc Warrant,$0.1449,0.0003,0.207%,70788525.00,United Kingdom,,400,Utilities,Electric Utilities: Central
RNXT,RenovoRx Inc. Common Stock,$1.39,-0.01,-0.714%,50835402.00,United States,2021,107655,Health Care,Biotechnology: Pharmaceutical Preparations
ROAD,Construction Partners Inc. Class A Common Stock,$110.36,2.19,2.025%,6183578401.00,United States,2018,642028,Industrials,Military/Government/Technical
ROCK,Gibraltar Industries Inc. Common Stock,$59.92,0.74,1.25%,1767062371.00,United States,1993,130999,Industrials,Steel/Iron Ore
ROIV,Roivant Sciences Ltd. Common Shares,$11.23,0.03,0.268%,7634222166.00,United Kingdom,,4927975,Health Care,Biotechnology: Pharmaceutical Preparations
ROKU,Roku Inc. Class A Common Stock,$78.50,3.90,5.228%,11512574500.00,United States,2017,5681717,Telecommunications,Cable & Other Pay Television Services
ROMA,Roma Green Finance Limited Ordinary Shares,$3.70,0.13,3.641%,57572000.00,Hong Kong,2024,84376,Consumer Discretionary,Professional Services
ROOT,Root Inc. Class A Common Stock,$151.73,12.56,9.025%,2331404736.00,United States,2020,785786,Finance,Property-Casualty Insurers
ROP,Roper Technologies Inc. Common Stock,$572.87,3.385,0.594%,61592345479.00,United States,1992,336683,Industrials,Industrial Machinery/Components
ROST,Ross Stores Inc. Common Stock,$143.80,1.56,1.097%,47284527242.00,United States,1985,1496438,Consumer Discretionary,Clothing/Shoe/Accessory Stores
RPAY,Repay Holdings Corporation Class A Common Stock,$5.22,0.07,1.359%,491463047.00,United States,2018,1190935,Consumer Discretionary,Business Services
RPD,Rapid7 Inc. Common Stock,$23.72,0.55,2.374%,1523756149.00,United States,2015,723885,Technology,Computer Software: Prepackaged Software
RPID,Rapid Micro Biosystems Inc. Class A Common Stock,$3.67,0.13,3.672%,160862343.00,United States,2021,68468,Industrials,Biotechnology: Laboratory Analytical Instruments
RPRX,Royalty Pharma plc Class A Ordinary Shares ,$33.78,0.03,0.089%,18992476287.00,United States,2020,2743303,Health Care,Biotechnology: Pharmaceutical Preparations
RPTX,Repare Therapeutics Inc. Common Shares,$1.47,-0.02,-1.342%,63050362.00,Canada,2020,129515,Health Care,Biotechnology: Pharmaceutical Preparations
RR,Richtech Robotics Inc. Class B Common Stock,$2.36,0.02,0.855%,270936923.00,United States,2023,14797856,Industrials,Industrial Machinery/Components
RRBI,Red River Bancshares Inc. Common Stock,$56.00,0.57,1.028%,380147992.00,United States,2019,8579,Consumer Discretionary,Hotels/Resorts
RRGB,Red Robin Gourmet Burgers Inc. Common Stock,$6.62,0.55,9.061%,117411764.00,United States,2002,1369073,Consumer Discretionary,Restaurants
RRR,Red Rock Resorts Inc. Class A Common Stock,$50.04,0.64,1.296%,5308150526.00,United States,2016,393580,Consumer Discretionary,Hotels/Resorts
RSLS,ReShape Lifesciences Inc. Common Stock,$4.18,-0.07,-1.647%,3085998.00,United States,2016,241498,Health Care,Medical/Dental Instruments
RSSS,Research Solutions Inc Common Stock,$2.77,-0.12,-4.152%,89910674.00,United States,,18975,Consumer Discretionary,Business Services
RSVR,Reservoir Media Inc. Common Stock,$7.30,0.00,0.00%,476709352.00,United States,2021,102027,Consumer Discretionary,Services-Misc. Amusement & Recreation
RTACU,Renatus Tactical Acquisition Corp I Unit,$12.40,0.09,0.731%,0.00,United States,2025,422159,Finance,Blank Checks
RUM,Rumble Inc. Class A Common Stock,$9.21,0.34,3.833%,4001040610.00,United States,2021,1728567,Technology,Computer Software: Programming Data Processing
RUMBW,Rumble Inc. Warrant,$3.25,0.05,1.563%,1411876437.00,United States,2021,14995,Technology,Computer Software: Programming Data Processing
RUN,Sunrun Inc. Common Stock,$8.51,0.13,1.551%,1944419860.00,United States,2015,15426688,Miscellaneous,Industrial Machinery/Components
RUSHA,Rush Enterprises Inc. Common Stock Cl A,$50.62,0.36,0.716%,3939097603.00,United States,,233710,Consumer Discretionary,Retail-Auto Dealers and Gas Stations
RUSHB,Rush Enterprises Inc. Class B,$52.69,0.54,1.035%,4100178836.00,United States,,15066,Consumer Discretionary,Retail-Auto Dealers and Gas Stations
RVMD,Revolution Medicines Inc. Common Stock,$41.09,0.89,2.214%,7653733383.00,United States,2020,1272887,Health Care,Biotechnology: Biological Products (No Diagnostic Substances)
RVMDW,Revolution Medicines Inc. Warrant,$0.2024,0.0264,15.00%,37700551.00,United States,,176879,,
RVPH,Reviva Pharmaceuticals Holdings Inc. Common Stock ,$0.8215,0.0215,2.688%,38396868.00,United States,2020,356017,Health Care,Biotechnology: Pharmaceutical Preparations
RVPHW,Reviva Pharmaceuticals Holdings Inc. Warrants,$0.0457,-0.0024,-4.99%,2136016.00,United States,2018,39012,Health Care,Biotechnology: Pharmaceutical Preparations
RVSB,Riverview Bancorp Inc Common Stock,$5.51,0.16,2.991%,115578862.00,United States,,107146,Finance,Savings Institutions
RVSN,Rail Vision Ltd. Ordinary Share,$0.3904,0.0143,3.802%,20296189.00,Israel,2022,353883,Industrials,Railroads
RVSNW,Rail Vision Ltd. Warrant,$0.0732,0.005,7.331%,3805535.00,Israel,2022,3100,Industrials,Railroads
RVYL,Ryvyl Inc. Common Stock,$0.76,-0.139,-15.462%,6355872.00,United States,,8713225,Consumer Discretionary,Professional Services
RWAY,Runway Growth Finance Corp. Common Stock,$9.94,0.21,2.158%,371233434.00,United States,2021,330893,Finance,Finance: Consumer Services
RWAYL,Runway Growth Finance Corp. 7.50% Notes due 2027,$25.0532,0.0532,0.213%,935672583.00,United States,,1011,Finance,Finance: Consumer Services
RWAYZ,Runway Growth Finance Corp. 8.00% Notes due 2027,$25.1481,0.008,0.032%,939216854.00,United States,,706,Finance,Finance: Consumer Services
RXRX,Recursion Pharmaceuticals Inc. Class A Common Stock,$5.49,0.92,20.131%,2231658363.00,United States,2021,60017421,Health Care,Biotechnology: Biological Products (No Diagnostic Substances)
RXST,RxSight Inc. Common Stock,$15.04,0.12,0.804%,611180194.00,United States,2021,626455,Health Care,Ophthalmic Goods
RXT,Rackspace Technology Inc. Common Stock,$1.18,0.02,1.724%,280118678.00,United States,2020,632906,Technology,Computer Software: Programming Data Processing
RYAAY,Ryanair Holdings plc American Depositary Shares,$57.18,1.31,2.345%,31420256643.00,Ireland,1997,954602,Consumer Discretionary,Air Freight/Delivery Services
RYET,Ruanyun Edai Technology Inc. Ordinary shares,$7.65,-0.07,-0.907%,258187531.00,China,2025,638380,Technology,Computer Software: Prepackaged Software
RYTM,Rhythm Pharmaceuticals Inc. Common Stock,$68.11,1.93,2.916%,4333258458.00,United States,2017,707958,Health Care,Biotechnology: Pharmaceutical Preparations
RZLT,Rezolute Inc. Common Stock (NV),$4.43,0.12,2.784%,378850579.00,United States,,886544,Health Care,Biotechnology: Pharmaceutical Preparations
RZLV,Rezolve AI PLC Ordinary Shares,$2.04,0.03,1.493%,497089603.00,United Kingdom,,2302063,Technology,Computer Software: Programming Data Processing
RZLVW,Rezolve AI PLC Warrants,$0.4531,-0.0219,-4.611%,110407500.00,United Kingdom,,33785,Technology,Computer Software: Programming Data Processing
SABR,Sabre Corporation Common Stock,$2.76,0.06,2.222%,1070346111.00,United States,2014,2623739,Technology,Computer Software: Programming Data Processing
SABS,SAB Biotherapeutics Inc. Common Stock,$1.81,-0.025,-1.362%,16817972.00,United States,2021,2411,Health Care,Biotechnology: Biological Products (No Diagnostic Substances)
SABSW,SAB Biotherapeutics Inc. Warrant,$0.0392,-0.0001,-0.254%,364235.00,United States,2021,112,Health Care,Biotechnology: Biological Products (No Diagnostic Substances)
SAFT,Safety Insurance Group Inc. Common Stock,$80.03,0.41,0.515%,1191930967.00,United States,2002,36292,Finance,Property-Casualty Insurers
SAGE,Sage Therapeutics Inc. Common Stock,$6.85,0.07,1.032%,428951754.00,United States,2014,772671,Health Care,Biotechnology: Pharmaceutical Preparations
SAGT,SAGTEC GLOBAL LIMITED Ordinary shares,$2.08,-0.27,-11.489%,26104000.00,Malaysia,2025,1039778,Technology,Computer Software: Prepackaged Software
SAIA,Saia Inc. Common Stock,$251.43,-2.02,-0.797%,6696587877.00,United States,,826728,Industrials,Trucking Freight/Courier Services
SAIC,Science Applications International Corporation Common Stock,$105.32,2.87,2.801%,4936642769.00,United States,,728378,Technology,EDP Services
SAIH,SAIHEAT Limited Class A Ordinary Shares,$6.98,0.38,5.758%,12235591.00,Singapore,2021,7956,Technology,EDP Services
SAIHW,SAIHEAT Limited Warrant,$0.1201,-0.0029,-2.358%,210529.00,Singapore,2021,3000,Technology,EDP Services
SAIL,SailPoint Inc. Common Stock,$19.07,1.05,5.827%,10613887024.00,United States,2025,1568574,Technology,Computer Software: Prepackaged Software
SAMG,Silvercrest Asset Management Group Inc. Class A Common Stock,$15.00,0.21,1.42%,201145305.00,United States,2013,38831,Finance,Investment Managers
SANA,Sana Biotechnology Inc. Common Stock,$2.84,0.29,11.373%,640577276.00,United States,2021,5916639,Health Care,Biotechnology: Biological Products (No Diagnostic Substances)
SANG,Sangoma Technologies Corporation Common Shares,$5.68,-0.035,-0.612%,190313506.00,Canada,,1762,Technology,Computer Software: Programming Data Processing
SANM,Sanmina Corporation Common Stock,$87.16,1.13,1.313%,4659905418.00,United States,1993,244319,Technology,Electrical Products
SANW,S&W Seed Company Common Stock (NV),$5.48,-0.245,-4.279%,11764497.00,United States,,4957,Consumer Staples,Farming/Seeds/Milling
SATL,Satellogic Inc. Class A Common Stock,$3.48,-0.05,-1.416%,362301335.00,Uruguay,,944783,Technology,Radio And Television Broadcasting And Communications Equipment
SATLW,Satellogic Inc. Warrant,$0.478,0.018,3.913%,49764379.00,Uruguay,,2437,Technology,Radio And Television Broadcasting And Communications Equipment
SATS,EchoStar  Corporation Common Stock,$17.48,-1.55,-8.145%,5023378627.00,United States,,4483087,Consumer Discretionary,Telecommunications Equipment
SAVA,Cassava Sciences Inc. Common Stock,$2.19,0.07,3.302%,105794292.00,United States,,1063227,Health Care,Biotechnology: Pharmaceutical Preparations
SBAC,SBA Communications Corporation Class A Common Stock,$225.68,-3.97,-1.729%,24249715679.00,United States,1999,482447,Real Estate,Real Estate Investment Trusts
SBC,SBC Medical Group Holdings Incorporated Common Stock,$4.72,-0.39,-7.632%,489045105.00,United States,2022,91019,Health Care,Medical/Nursing Services
SBCF,Seacoast Banking Corporation of Florida Common Stock,$25.90,0.43,1.688%,2227023103.00,United States,,578167,Finance,Major Banks
SBCWW,SBC Medical Group Holdings Incorporated Warrants,$0.21,0.01,5.00%,21758363.00,United States,2022,20152,Health Care,Medical/Nursing Services
SBET,SharpLink Gaming Inc. Common Stock,$41.48,-1.04,-2.446%,27363692.00,Israel,,1607444,Technology,Computer Software: Prepackaged Software
SBFG,SB Financial Group Inc. Common Stock,$18.23,0.19,1.053%,118953065.00,United States,,20445,Finance,Major Banks
SBFM,Sunshine Biopharma Inc. Common Stock,$1.51,0.03,2.027%,4088387.00,Canada,,55339,Health Care,Biotechnology: Pharmaceutical Preparations
SBFMW,Sunshine Biopharma Inc. Warrant,$0.245,-0.0628,-20.403%,663348.00,Canada,,3660,Health Care,Biotechnology: Pharmaceutical Preparations
SBGI,Sinclair Inc. Class A Common Stock,$13.17,0.34,2.65%,916257221.00,United States,1995,373591,Industrials,Broadcasting
SBLK,Star Bulk Carriers Corp. Common Shares,$16.69,0.31,1.893%,1954858492.00,Greece,,1788136,Consumer Discretionary,Marine Transportation
SBRA,Sabra Health Care REIT Inc. Common Stock,$17.85,0.08,0.45%,4247165811.00,United States,,2039172,Real Estate,Real Estate Investment Trusts
SBUX,Starbucks Corporation Common Stock,$89.64,2.65,3.046%,101866896000.00,United States,1992,8771392,Consumer Discretionary,Restaurants
SCHL,Scholastic Corporation Common Stock,$18.06,-0.19,-1.041%,481958172.00,United States,1992,221426,Consumer Discretionary,Books
SCKT,Socket Mobile Inc. Common Stock,$1.1241,0.0041,0.366%,8904582.00,United States,,4423,Technology,Computer Manufacturing
SCLX,Scilex Holding Company Common Stock,$6.31,-0.16,-2.473%,43864735.00,United States,2021,159269,Health Care,Biotechnology: Biological Products (No Diagnostic Substances)
SCLXW,Scilex Holding Company Warrant,$0.1145,0.0137,13.591%,795961.00,United States,2021,6991,Health Care,Biotechnology: Biological Products (No Diagnostic Substances)
SCNI,Scinai Immunotherapeutics Ltd. American Depositary Shares,$2.55,-0.70,-21.538%,2549793.00,Israel,2015,637033,Health Care,Biotechnology: Biological Products (No Diagnostic Substances)
SCNX,Scienture Holdings Inc. Common Stock,$1.06,0.02,1.923%,13903415.00,United States,,97808,Health Care,Other Pharmaceuticals
SCOR,comScore Inc. Common Stock,$5.09,-0.0482,-0.938%,25182139.00,United States,2018,4226,Consumer Discretionary,Business Services
SCPH,scPharmaceuticals Inc. Common Stock,$4.20,0.09,2.19%,221726308.00,United States,2017,424761,Health Care,Biotechnology: Pharmaceutical Preparations
SCSC,ScanSource Inc. Common Stock,$41.50,0.07,0.169%,937717732.00,United States,,168031,Technology,Retail: Computer Software & Peripheral Equipment
SCVL,Shoe Carnival Inc. Common Stock,$19.59,0.21,1.084%,532346555.00,United States,1993,316640,Consumer Discretionary,Clothing/Shoe/Accessory Stores
SCWO,374Water Inc. Common Stock,$0.4001,0.0001,0.025%,57887653.00,United States,,401816,Consumer Discretionary,Metal Fabrications
