Symbol,Name,Last Sale,Net Change,% Change,Market Cap,Country,IPO Year,Volume,Sector,Industry
CTMX,CytomX Therapeutics Inc. Common Stock,$2.64,0.24,10.00%,212840214.00,United States,2015,3414039,Health Care,Biotechnology: Pharmaceutical Preparations
CTNM,Contineum Therapeutics Inc. Class A Common Stock,$4.75,0.60,14.458%,122889858.00,United States,2024,67719,Health Care,Biotechnology: Pharmaceutical Preparations
CTNT,Cheetah Net Supply Chain Service Inc. Class A Common Stock,$1.64,-0.25,-13.228%,4382098.00,United States,2023,537826,Consumer Discretionary,Motor Vehicles
CTOR,Citius Oncology Inc. Common Stock,$1.0501,0.0801,8.258%,75137177.00,United States,2022,126369,Health Care,Biotechnology: Pharmaceutical Preparations
CTRM,Castor Maritime Inc. Common Shares,$2.26,-0.06,-2.586%,21836920.00,Cyprus,,23385,Consumer Discretionary,Marine Transportation
CTRN,Citi Trends Inc. Common Stock,$33.83,0.58,1.744%,280035707.00,United States,2005,119008,Consumer Discretionary,Clothing/Shoe/Accessory Stores
CTSH,Cognizant Technology Solutions Corporation Class A Common Stock,$80.28,0.96,1.21%,39573380790.00,United States,1998,2510383,Technology,EDP Services
CTSO,Cytosorbents Corporation Common Stock,$1.06,0.01,0.952%,66366999.00,United States,,61576,Health Care,Medical/Dental Instruments
CTXR,Citius Pharmaceuticals Inc. Common Stock,$0.851,-0.0048,-0.561%,8757075.00,United States,,96211,Health Care,Biotechnology: Pharmaceutical Preparations
CUB,Lionheart Holdings Class A Ordinary Shares,$10.54,0.01,0.095%,334840791.00,United States,2024,22634,Industrials,Industrial Machinery/Components
CUBA,Herzfeld Caribbean Basin Fund Inc. (The) Common Stock,$2.4101,0.0001,0.004%,0.00,United States,,57042,Finance,Investment Managers
CUBWU,Lionheart Holdings Unit,$10.62,0.00,0.00%,0.00,United States,2024,1,Finance,Blank Checks
CUBWW,Lionheart Holdings Warrant,$0.32,0.02,6.667%,0.00,United States,2024,7290,,
CUE,Cue Biopharma Inc. Common Stock,$0.641,0.0109,1.73%,48299274.00,United States,2018,132233,Health Care,Biotechnology: Pharmaceutical Preparations
CUPR,Cuprina Holdings (Cayman) Limited Class A Ordinary Shares,$5.18,-0.27,-4.954%,108780000.00,Singapore,2025,116079,Consumer Discretionary,Military/Government/Technical
CURI,CuriosityStream Inc. Class A Common Stock,$5.65,-0.03,-0.528%,325586832.00,United States,2020,709040,Consumer Discretionary,Movies/Entertainment
CURIW,CuriosityStream Inc. Warrant,$0.0745,-0.023,-23.59%,4293136.00,United States,2020,5005,Consumer Discretionary,Movies/Entertainment
CURR,Currenc Group Inc. Ordinary Shares,$0.50,0.00,0.00%,23264000.00,Singapore,,289867,Consumer Discretionary,Business Services
CVAC,CureVac N.V. Ordinary Shares,$4.41,-0.05,-1.121%,989331713.00,Germany,2020,301444,Health Care,Biotechnology: Pharmaceutical Preparations
CVBF,CVB Financial Corporation Common Stock,$19.00,0.41,2.205%,2618287476.00,United States,,525196,Finance,Major Banks
CVCO,Cavco Industries Inc. Common Stock When Issued,$428.63,4.78,1.128%,3438349844.00,United States,,534126,Consumer Discretionary,Homebuilding
CVGI,Commercial Vehicle Group Inc. Common Stock,$1.41,0.04,2.92%,48836448.00,United States,2004,207422,Consumer Discretionary,Auto Parts:O.E.M.
CVGW,Calavo Growers Inc. Common Stock,$27.68,1.07,4.021%,493714514.00,United States,,269371,Consumer Discretionary,Specialty Foods
CVKD,Cadrenal Therapeutics Inc. Common Stock,$15.10,0.49,3.354%,29696793.00,United States,2023,23719,Health Care,Biotechnology: Pharmaceutical Preparations
CVLT,Commvault Systems Inc. Common Stock,$188.57,1.40,0.748%,8320732335.00,United States,2006,292521,Technology,Computer Software: Prepackaged Software
CVRX,CVRx Inc. Common Stock,$6.56,0.10,1.548%,171036249.00,United States,2021,173573,Health Care,Medical/Dental Instruments
CVV,CVD Equipment Corporation Common Stock,$3.13,-0.35,-10.057%,21540153.00,United States,,43432,Technology,Industrial Machinery/Components
CWBC,Community West Bancshares Common Stock,$17.99,0.255,1.438%,342913579.00,United States,,58018,Finance,Major Banks
CWCO,Consolidated Water Co. Ltd. Ordinary Shares,$27.22,0.05,0.184%,433252166.00,Cayman Islands,,60596,Utilities,Water Supply
CWD,CaliberCos Inc. Class A Common Stock,$3.59,0.00,0.00%,4674370.00,United States,2023,9228,Finance,Real Estate
CWST,Casella Waste Systems Inc. Class A Common Stock,$116.58,1.41,1.224%,7398567835.00,United States,1997,446238,Utilities,Environmental Services
CXAI,CXApp Inc. Class A Common Stock,$1.01,0.00,0.00%,20984767.00,United States,2021,545402,Technology,EDP Services
CXAIW,CXApp Inc. Warrant,$0.0738,-0.0002,-0.27%,1533342.00,United States,2021,809,Technology,EDP Services
CXDO,Crexendo Inc. Common Stock,$5.70,0.19,3.448%,165474095.00,United States,,115952,Telecommunications,Telecommunications Equipment
CYBR,CyberArk Software Ltd. Ordinary Shares,$403.76,11.58,2.953%,19969449961.00,Israel,2014,1530737,Technology,Computer Software: Prepackaged Software
CYCC,Cyclacel Pharmaceuticals Inc. Common Stock,$0.37,-0.235,-38.843%,8240768.00,United States,,7526460,Health Care,Biotechnology: Pharmaceutical Preparations
CYCCP,Cyclacel Pharmaceuticals Inc. 6% Convertible Preferred Stock,$5.609,-0.191,-3.293%,124925589.00,United States,,1662,Health Care,Biotechnology: Pharmaceutical Preparations
CYCN,Cyclerion Therapeutics Inc. Common Stock,$3.18,0.01,0.315%,10208099.00,United States,,15148,Health Care,Biotechnology: Pharmaceutical Preparations
CYCU,Cycurion Inc. Common Stock,$0.4113,-0.0687,-14.313%,12932879.00,United States,2025,4363668,Technology,EDP Services
CYCUW,Cycurion Inc. Warrant,$0.06,-0.002,-3.226%,1886634.00,United States,2025,2057,Technology,EDP Services
CYN,Cyngn Inc. Common Stock,$4.82,-0.09,-1.833%,8444187.00,United States,2021,37981,Technology,EDP Services
CYRX,CryoPort Inc. Common Stock,$7.00,0.34,5.105%,350960526.00,United States,,622076,Health Care,Biotechnology: Pharmaceutical Preparations
CYTK,Cytokinetics Incorporated Common Stock,$32.30,0.22,0.686%,3857501564.00,United States,2004,768088,Health Care,Biotechnology: Pharmaceutical Preparations
CZFS,Citizens Financial Services Inc. Common Stock,$61.38,2.33,3.946%,292148667.00,United States,,15284,Finance,Major Banks
CZNC,Citizens & Northern Corp Common Stock,$18.57,0.50,2.767%,287734555.00,United States,,62353,Finance,Major Banks
CZR,Caesars Entertainment Inc. Common Stock,$25.73,0.10,0.39%,5351019702.00,United States,,2874015,Consumer Discretionary,Hotels/Resorts
CZWI,Citizens Community Bancorp Inc. Common Stock,$14.20,0.18,1.284%,141843757.00,United States,2006,23919,Finance,Savings Institutions
DAAQ,Digital Asset Acquisition Corp. Class A Ordinary shares,$10.50,0.02,0.191%,0.00,United States,2025,125817,,
DAAQU,Digital Asset Acquisition Corp. Units,$10.98,0.0589,0.539%,0.00,United States,2025,38358,Finance,Blank Checks
DAAQW,Digital Asset Acquisition Corp. Warrant,$0.97,-0.04,-3.96%,0.00,United States,2025,14419,,
DADA,Dada Nexus Limited American Depositary Shares,$2.01,-0.01,-0.495%,519074768.00,China,2020,303892,Technology,Computer Software: Programming Data Processing
DAIO,Data I/O Corporation Common Stock,$2.76,-0.04,-1.429%,25501658.00,United States,1981,11746,Industrials,Electrical Products
DAKT,Daktronics Inc. Common Stock,$13.96,0.41,3.026%,696510370.00,United States,1994,288876,Consumer Discretionary,Miscellaneous manufacturing industries
DALN,DallasNews Corporation Series A Common Stock,$4.2015,-0.0385,-0.908%,22488487.00,United States,,8239,Consumer Discretionary,Newspapers/Magazines
DARE,Dare Bioscience Inc. Common Stock,$3.20,-0.06,-1.84%,28321235.00,United States,2014,36970,Health Care,Biotechnology: Pharmaceutical Preparations
DASH,DoorDash Inc. Class A Common Stock,$218.45,2.61,1.209%,92566904106.00,United States,,2586901,Consumer Discretionary,Business Services
DATS,DatChat Inc. Common Stock,$2.69,0.06,2.281%,11323095.00,United States,2021,114985,Telecommunications,Telecommunications Equipment
DATSW,DatChat Inc. Series A Warrant,$0.2497,0.00,0.00%,1051069.00,United States,2021,6,Telecommunications,Telecommunications Equipment
DAVE,Dave Inc. Class A Common Stock,$221.55,12.38,5.919%,2955574482.00,United States,,339166,Finance,Finance: Consumer Services
DAVEW,Dave Inc. Warrants,$1.00,0.07,7.527%,13340440.00,United States,,180692,Finance,Finance: Consumer Services
DAWN,Day One Biopharmaceuticals Inc. Common Stock,$7.19,0.24,3.453%,728796145.00,United States,2021,1445731,Health Care,Biotechnology: Pharmaceutical Preparations
DBVT,DBV Technologies S.A. American Depositary Shares,$9.13,0.58,6.784%,250068637.00,France,2014,39365,Health Care,Biotechnology: Biological Products (No Diagnostic Substances)
DBX,Dropbox Inc. Class A Common Stock,$29.47,-0.04,-0.136%,8295588337.00,United States,2018,2572772,Technology,Computer Software: Prepackaged Software
DCBO,Docebo Inc. Common Shares,$27.00,0.15,0.559%,800095914.00,Canada,,68083,Technology,Computer Software: Prepackaged Software
DCGO,DocGo Inc. Common Stock,$1.53,0.10,6.993%,151629626.00,United States,2020,604206,Health Care,Medical/Nursing Services
DCOM,Dime Community Bancshares Inc. Common Stock,$26.95,1.13,4.376%,1180910246.00,United States,,267947,Finance,Major Banks
DCOMG,Dime Community Bancshares Inc. 9.000% Fixed-to-Floating Rate Subordinated Notes due 2034,$26.95,0.355,1.335%,1055055767.00,United States,,142,Finance,Major Banks
DCOMP,Dime Community Bancshares Inc. Fixed-Rate Non-Cumulative Perpetual Preferred Stock Series A,$17.62,0.04,0.228%,772083062.00,United States,,2415,Finance,Major Banks
DCTH,Delcath Systems Inc. Common Stock,$16.38,-0.49,-2.905%,570452878.00,United States,,390549,Health Care,Medical/Dental Instruments
DDI,DoubleDown Interactive Co. Ltd. American Depository Shares,$10.49,0.09,0.865%,519815586.00,South Korea,2021,3702,Technology,EDP Services
DDOG,Datadog Inc. Class A Common Stock,$122.16,0.41,0.337%,42188350699.00,United States,2019,4537077,Technology,Computer Software: Prepackaged Software
DEFT,Defi Technologies Inc. Common Stock,$3.35,0.24,7.717%,1104940630.00,Canada,,3348561,Finance,Finance: Consumer Services
DENN,Denny's Corporation Common Stock,$4.03,0.14,3.599%,206541796.00,United States,,470792,Consumer Discretionary,Restaurants
DERM,Journey Medical Corporation Common Stock,$7.39,-0.15,-1.989%,172155733.00,United States,2021,55571,Health Care,Biotechnology: Pharmaceutical Preparations
DEVS,DevvStream Corp. Common Stock,$0.42,-0.03,-6.667%,12648608.00,Canada,2024,1672005,Finance,Finance/Investors Services
DFDV,DeFi Development Corp. Common Stock,$18.96,4.67,32.68%,274294149.00,United States,2023,1847614,Finance,Finance: Consumer Services
DFLI,Dragonfly Energy Holdings Corp. Common Stock (NV),$0.3789,0.0121,3.299%,3547696.00,United States,2021,281456,Miscellaneous,Industrial Machinery/Components
DFLIW,Dragonfly Energy Holdings Corp. Warrant,$0.0227,-0.0001,-0.439%,212543.00,United States,2021,14044,Miscellaneous,Industrial Machinery/Components
DGICA,Donegal Group Inc. Class A Common Stock,$19.48,-0.09,-0.46%,703163151.00,United States,,85219,Finance,Property-Casualty Insurers
DGICB,Donegal Group Inc. Class B Common Stock,$17.98,0.00,0.00%,649018145.00,United States,1986,45,Finance,Property-Casualty Insurers
DGII,Digi International Inc. Common Stock,$34.18,0.77,2.305%,1266939738.00,United States,1989,133564,Telecommunications,Computer Communications Equipment
DGLY,Digital Ally Inc. Common Stock,$2.47,0.21,9.292%,4121175.00,United States,,250175,Technology,Radio And Television Broadcasting And Communications Equipment
DGNX,Diginex Limited Ordinary Shares,$63.00,20.50,48.235%,1461155850.00,Hong Kong,2025,114298,Technology,EDP Services
DGXX,Digi Power X Inc. Subordinate Voting Shares,$1.51,0.05,3.425%,54824884.00,Canada,,396535,Finance,Finance: Consumer Services
DH,Definitive Healthcare Corp. Class A Common Stock,$3.74,0.18,5.056%,401458717.00,United States,2021,694978,Technology,Computer Software: Prepackaged Software
DHAI,DIH Holdings US Inc. Class A Common Stock,$0.2193,-0.0079,-3.477%,10380851.00,United States,2024,609914,Health Care,Medical/Dental Instruments
DHAIW,DIH Holding US Inc. Warrants,$0.0151,0.0014,10.219%,714778.00,United States,2024,17816,Health Care,Medical/Dental Instruments
DHC,Diversified Healthcare Trust Common Shares of Beneficial Interest,$3.38,0.10,3.049%,815427991.00,United States,,612809,Real Estate,Real Estate Investment Trusts
DHCNI,Diversified Healthcare Trust 5.625% Senior Notes due 2042,$15.77,-0.195,-1.221%,3804526456.00,United States,,17934,Real Estate,Real Estate Investment Trusts
DHCNL,Diversified Healthcare Trust 6.25% Senior Notes Due 2046,$16.65,0.05,0.301%,4016827235.00,United States,,13135,Real Estate,Real Estate Investment Trusts
DHIL,Diamond Hill Investment Group Inc. Class A Common Stock,$139.20,1.70,1.236%,379694587.00,United States,,146251,Finance,Investment Managers
DIBS,1stdibs.com Inc. Common Stock,$2.76,0.01,0.364%,98487975.00,United States,2021,73891,Consumer Discretionary,Catalog/Specialty Distribution
DIOD,Diodes Incorporated Common Stock,$49.40,1.93,4.066%,2292227085.00,United States,,517627,Technology,Semiconductors
DIST,Distoken Acquisition Corporation Ordinary Shares,$14.45,2.45,20.417%,0.00,China,2023,51375,Finance,Blank Checks
DISTR,Distoken Acquisition Corporation Right,$0.33,0.07,26.923%,0.00,China,2023,510601,Finance,Blank Checks
DISTW,Distoken Acquisition Corporation Warrant,$0.1001,0.0251,33.467%,0.00,China,2023,431207,Finance,Blank Checks
DJCO,Daily Journal Corp. (S.C.) Common Stock,$421.83,-0.35,-0.083%,581039610.00,United States,,36124,Consumer Discretionary,Newspapers/Magazines
DJT,Trump Media & Technology Group Corp. Common Stock,$20.90,0.78,3.877%,4611052217.00,United States,2024,7039220,Technology,Computer Software: Programming Data Processing
DJTWW,Trump Media & Technology Group Corp. Warrants,$12.5278,0.0378,0.303%,2763939711.00,United States,2021,176208,Technology,Computer Software: Programming Data Processing
DKNG,DraftKings Inc. Class A Common Stock,$35.81,2.08,6.167%,17771988446.00,United States,2019,11947120,Consumer Discretionary,Services-Misc. Amusement & Recreation
DLHC,DLH Holdings Corp.,$5.50,0.37,7.212%,79125574.00,United States,,90826,Consumer Discretionary,Professional Services
DLO,DLocal Limited Class A Common Shares,$10.49,0.24,2.341%,2994634177.00,Uruguay,2021,773526,Consumer Discretionary,Business Services
DLPN,Dolphin Entertainment Inc. Common Stock,$1.18,0.02,1.724%,13178380.00,United States,,17979,Consumer Discretionary,Other Consumer Services
DLTH,Duluth Holdings Inc. Class B Common Stock,$1.93,0.08,4.324%,67817398.00,United States,2015,73433,Consumer Discretionary,Clothing/Shoe/Accessory Stores
DLTR,Dollar Tree Inc. Common Stock,$94.50,-2.17,-2.245%,19721754801.00,United States,1995,5819586,Consumer Discretionary,Department/Specialty Retail Stores
DMAA,Drugs Made In America Acquisition Corp. Ordinary Shares,$10.16,0.00,0.00%,0.00,United States,2025,16821,,
DMAAR,Drugs Made In America Acquisition Corp. Rights,$0.13,-0.0175,-11.864%,0.00,United States,2025,1481,Finance,Blank Checks
DMAAU,Drugs Made In America Acquisition Corp. Units,$10.29,0.01,0.097%,0.00,United States,2025,960,,
DMAC,DiaMedica Therapeutics Inc. Common Stock,$4.14,0.05,1.222%,177537545.00,United States,2018,124071,Health Care,Biotechnology: Pharmaceutical Preparations
DMLP,Dorchester Minerals L.P. Common Units Representing Limited Partnership Interests,$27.67,0.51,1.878%,1309891049.00,United States,,94825,Energy,Oil & Gas Production
DMRC,Digimarc Corporation Common Stock,$13.41,-0.40,-2.896%,289012333.00,United States,,195116,Technology,EDP Services
DNLI,Denali Therapeutics Inc. Common Stock,$14.70,0.48,3.376%,2135561595.00,United States,2017,1794419,Health Care,Biotechnology: Biological Products (No Diagnostic Substances)
DNTH,Dianthus Therapeutics Inc. Common Stock,$18.85,0.28,1.508%,606215661.00,United States,2018,370376,Health Care,Biotechnology: Pharmaceutical Preparations
DNUT,Krispy Kreme Inc. Common Stock,$2.92,0.00,0.00%,498736000.00,United States,2021,2349317,Consumer Staples,Food Chains
DOCU,DocuSign Inc. Common Stock,$75.28,-17.62,-18.967%,15243426122.00,United States,1989,22574864,Technology,Computer Software: Prepackaged Software
DOGZ,Dogness (International) Corporation Class A Common Stock,$26.75,0.74,2.845%,340545102.00,China,2017,300435,Consumer Discretionary,Miscellaneous manufacturing industries
DOMH,Dominari Holdings Inc. Common Stock,$5.40,0.54,11.111%,79401843.00,United States,,334286,Health Care,Biotechnology: Pharmaceutical Preparations
DOMO,Domo Inc. Class B Common Stock,$14.63,0.34,2.379%,584316143.00,United States,2018,722574,Technology,Computer Software: Prepackaged Software
DOOO,BRP Inc. (Recreational Products) Common Subordinate Voting Shares,$46.67,-0.39,-0.829%,3413072027.00,Canada,,229411,Consumer Discretionary,Industrial Specialties
DORM,Dorman Products Inc. Common Stock,$126.67,-0.34,-0.268%,3864850411.00,United States,,148591,Consumer Discretionary,Auto Parts:O.E.M.
DOX,Amdocs Limited Ordinary Shares,$92.28,1.30,1.429%,10417541246.00,Guernsey,,658574,Technology,EDP Services
DOYU,DouYu International Holdings Limited ADS,$6.92,0.26,3.904%,208837704.00,China,2019,32487,Technology,Computer Software: Programming Data Processing
DPRO,Draganfly Inc. Common Shares,$2.97,0.54,22.222%,16171035.00,Canada,,903728,Industrials,Aerospace
DPZ,Domino's Pizza Inc Common Stock,$468.21,8.18,1.778%,16032201946.00,United States,2004,432096,Consumer Discretionary,Food Distributors
DRCT,Direct Digital Holdings Inc. Class A Common Stock,$0.5503,0.0201,3.791%,10406987.00,United States,2022,166746,Consumer Discretionary,Advertising
DRDB,Roman DBDR Acquisition Corp. II Ordinary shares,$10.33,0.00,0.00%,0.00,United States,2025,307979,,
DRDBU,Roman DBDR Acquisition Corp. II Unit,$10.5107,-0.0393,-0.373%,0.00,United States,2024,775,,
DRDBW,Roman DBDR Acquisition Corp. II Warrants,$0.46,-0.01,-2.128%,0.00,United States,2025,148073,,
DRIO,DarioHealth Corp. Common Stock,$0.701,0.001,0.143%,30808546.00,Israel,,93134,Health Care,Medical/Dental Instruments
DRMA,Dermata Therapeutics Inc. Common Stock,$0.7451,0.0411,5.838%,4752336.00,United States,2021,70164,Health Care,Biotechnology: Pharmaceutical Preparations
DRMAW,Dermata Therapeutics Inc. Warrant,$0.0154,-0.0075,-32.751%,98223.00,United States,2021,8401,Health Care,Biotechnology: Pharmaceutical Preparations
DRRX,DURECT Corporation Common Stock,$0.541,0.002,0.371%,16794036.00,United States,2000,36038,Health Care,Biotechnology: Pharmaceutical Preparations
DRS,Leonardo DRS Inc. Common Stock,$44.385,-0.015,-0.034%,11808593964.00,Israel,,564276,Industrials,Industrial Machinery/Components
DRTS,Alpha Tau Medical Ltd. Ordinary Shares,$3.02,0.21,7.473%,212549321.00,Israel,,66894,Health Care,Medical/Dental Instruments
DRTSW,Alpha Tau Medical Ltd. Warrant,$0.2398,0.0298,14.19%,16877261.00,Israel,,1200,Health Care,Medical/Dental Instruments
DRUG,Bright Minds Biosciences Inc. Common Stock,$27.61,-0.20,-0.719%,192965986.00,Canada,,19994,Health Care,Biotechnology: Pharmaceutical Preparations
DRVN,Driven Brands Holdings Inc. Common Stock,$18.36,0.81,4.615%,3016095591.00,United States,2021,1311614,Consumer Discretionary,Automotive Aftermarket
DSGN,Design Therapeutics Inc. Common Stock,$4.01,0.01,0.25%,227642399.00,United States,2021,119154,Health Care,Biotechnology: Pharmaceutical Preparations
DSGR,Distribution Solutions Group Inc. Common Stock,$27.62,0.41,1.507%,1282626978.00,United States,,44206,Consumer Discretionary,Industrial Specialties
DSGX,Descartes Systems Group Inc. (The) Common Stock,$102.25,0.65,0.64%,8731142020.00,Canada,,657253,Technology,Computer Software: Prepackaged Software
DSP,Viant Technology Inc. Class A Common Stock,$14.55,0.82,5.972%,910343797.00,United States,2021,247492,Technology,Computer Software: Programming Data Processing
DSWL,Deswell Industries Inc. Common Shares,$2.3204,-0.0297,-1.264%,36976129.00,Macau,1995,34807,Industrials,Plastic Products
DSY,Big Tree Cloud Holdings Limited Ordinary Shares,$1.321,-0.0163,-1.219%,75403401.00,China,,3885,Consumer Discretionary,Containers/Packaging
DSYWW,Big Tree Cloud Holdings Limited Warrants,$0.0149,-0.0007,-4.487%,850500.00,China,,8576,Consumer Discretionary,Containers/Packaging
DTCK,Davis Commodities Limited Ordinary Shares,$0.8039,0.2039,33.983%,19696052.00,Singapore,2023,61776773,Industrials,Farming/Seeds/Milling
DTI,Drilling Tools International Corporation Common Stock,$3.04,0.245,8.766%,108201920.00,United States,2021,83050,Industrials,Metal Fabrications
DTIL,Precision BioSciences Inc. Common Stock,$5.49,0.36,7.018%,60874405.00,United States,2019,297381,Health Care,Biotechnology: Biological Products (No Diagnostic Substances)
DTSQ,DT Cloud Star Acquisition Corporation Ordinary Shares,$10.47,0.00,0.00%,0.00,United States,2024,3,,
DTSQU,DT Cloud Star Acquisition Corporation Units,$10.45,0.10,0.966%,0.00,United States,2024,100,,
DTSS,Datasea Inc. Common Stock,$2.35,0.2222,10.443%,17986597.00,China,,434443,Technology,Computer Software: Prepackaged Software
DTST,Data Storage Corporation Common Stock,$3.8806,0.0756,1.987%,27707069.00,United States,,38095,Technology,EDP Services
DTSTW,Data Storage Corporation Warrant,$0.2895,0.0188,6.945%,2066999.00,United States,,7798,Technology,EDP Services
DUO,Fangdd Network Group Ltd. Class A Ordinary Shares,$0.20,0.013,6.952%,9810323.00,China,2019,2286784,Finance,Real Estate
DUOL,Duolingo Inc. Class A Common Stock,$512.95,-10.04,-1.92%,23315754973.00,United States,2021,929408,Technology,Computer Software: Prepackaged Software
DUOT,Duos Technologies Group Inc. Common Stock,$8.59,0.54,6.708%,100107044.00,United States,,91087,Technology,Computer Software: Prepackaged Software
DVAX,Dynavax Technologies Corporation Common Stock,$10.24,0.29,2.915%,1229625856.00,United States,2004,1408713,Health Care,Biotechnology: Pharmaceutical Preparations
DVLT,Datavault AI Inc. Common Stock,$0.8368,0.0121,1.467%,55249042.00,United States,2018,302581,Technology,Semiconductors
DWSN,Dawson Geophysical Company Common Stock,$1.24,0.01,0.813%,38420361.00,United States,,3049,Energy,Oil & Gas Production
DWTX,Dogwood Therapeutics Inc. Common Stock,$4.89,0.005,0.102%,9345416.00,United States,2020,58772,Health Care,Biotechnology: Pharmaceutical Preparations
DXCM,DexCom Inc. Common Stock,$86.67,0.93,1.085%,33983957112.00,United States,2005,2422603,Health Care,Medical/Dental Instruments
DXLG,Destination XL Group Inc. Common Stock,$1.05,0.02,1.942%,56505754.00,United States,,103151,Consumer Discretionary,Clothing/Shoe/Accessory Stores
DXPE,DXP Enterprises Inc. Common Stock,$82.07,1.08,1.333%,1288030380.00,United States,,51112,Industrials,Industrial Machinery/Components
DXR,Daxor Corporation Common Stock,$9.25,0.37,4.167%,44770000.00,United States,,3745,Health Care,Medical/Dental Instruments
DXST,Decent Holding Inc Class A Ordinary Shares,$1.24,-0.09,-6.767%,20150000.00,China,2025,8299,Industrials,Miscellaneous
DYAI,Dyadic International Inc. Common Stock,$0.99,0.02,2.062%,29789754.00,United States,,33232,Health Care,Biotechnology: Biological Products (No Diagnostic Substances)
DYCQ,DT Cloud Acquisition Corporation Ordinary Shares,$10.80,0.08,0.746%,0.00,United Kingdom,2024,2537,,
DYCQR,DT Cloud Acquisition Corporation Right,$0.16,0.00,0.00%,0.00,United Kingdom,2024,40,,
DYN,Dyne Therapeutics Inc. Common Stock,$14.70,0.71,5.075%,1670898697.00,United States,2020,2674392,Health Care,Biotechnology: Pharmaceutical Preparations
DYNX,Dynamix Corporation Class A Ordinary Shares,$10.10,0.00,0.00%,0.00,United States,2024,72,,
DYNXU,Dynamix Corporation Unit,$10.24,0.00,0.00%,0.00,United States,2024,129,,
DYNXW,Dynamix Corporation Warrant,$0.35,0.00,0.00%,0.00,United States,2024,2857,,
EA,Electronic Arts Inc. Common Stock,$149.57,1.69,1.143%,37507066432.00,United States,,2783757,Technology,Computer Software: Prepackaged Software
EBAY,eBay Inc. Common Stock,$78.61,0.87,1.119%,36239210000.00,United States,1998,4755868,Consumer Discretionary,Business Services
EBC,Eastern Bankshares Inc. Common Stock,$14.93,0.37,2.541%,3151572909.00,United States,2020,1395163,Finance,Savings Institutions
EBMT,Eagle Bancorp Montana Inc. Common Stock,$16.66,0.06,0.361%,132483269.00,United States,2010,33358,Finance,Major Banks
EBON,Ebang International Holdings Inc. Class A Ordinary Shares,$3.66,-0.1051,-2.791%,23950813.00,China,2020,6596,Technology,Semiconductors
EBTC,Enterprise Bancorp Inc Common Stock,$40.00,1.20,3.093%,500335440.00,United States,,28574,Finance,Major Banks
ECBK,ECB Bancorp Inc. Common Stock,$15.89,0.10,0.633%,143449851.00,United States,2022,17634,Finance,Banks
ECDA,ECD Automotive Design Inc. Common Stock,$0.3229,-0.0292,-8.293%,11426030.00,United States,2022,12241410,Consumer Discretionary,Auto Manufacturing
ECDAW,ECD Automotive Design Inc. Warrant ,$0.0127,0.00,0.00%,449398.00,United States,2022,9900,Consumer Discretionary,Auto Manufacturing
ECOR,electroCore Inc. Common Stock,$5.73,0.37,6.903%,42520141.00,United States,2018,120660,Health Care,Biotechnology: Electromedical & Electrotherapeutic Apparatus
ECPG,Encore Capital Group Inc Common Stock,$38.41,1.16,3.114%,896842772.00,United States,,160297,Finance,Finance Companies
ECX,ECARX Holdings Inc. Class A Ordinary shares,$1.65,0.06,3.774%,570454543.00,China,,605738,Technology,EDP Services
ECXWW,ECARX Holdings Inc. Warrants,$0.0508,-0.0171,-25.184%,17563085.00,China,,2000,Technology,EDP Services
EDAP,EDAP TMS S.A. American Depositary Shares,$1.78,-0.03,-1.657%,66557913.00,France,1997,27341,Health Care,Biotechnology: Electromedical & Electrotherapeutic Apparatus
EDBL,Edible Garden AG Incorporated Common Stock,$2.63,-0.06,-2.23%,4353344.00,United States,2022,159188,Consumer Staples,Farming/Seeds/Milling
EDBLW,Edible Garden AG Incorporated Warrant,$0.0755,0.0005,0.667%,124972.00,United States,2022,29357,Consumer Staples,Farming/Seeds/Milling
